{
  "$schema": "https://json-schema.org/draft/2020-12/schema",
  "$id": "https://statyba-ecommerce.local/contracts/entities/v1/category.schema.json",
  "title": "CategoryContractV1",
  "type": "object",
  "additionalProperties": false,
  "required": [
    "id",
    "slug",
    "title",
    "parent_id",
    "path",
    "order"
  ],
  "properties": {
    "id": {
      "type": "integer",
      "minimum": 1
    },
    "slug": {
      "type": "string",
      "minLength": 1
    },
    "title": {
      "type": "string",
      "minLength": 1
    },
    "parent_id": {
      "type": ["integer", "null"],
      "minimum": 1
    },
    "path": {
      "type": "array",
      "items": {
        "type": "string",
        "minLength": 1
      }
    },
    "order": {
      "type": "integer",
      "minimum": 0
    },
    "children": {
      "type": "array",
      "items": {
        "type": "object",
        "additionalProperties": true,
        "required": [
          "id",
          "slug",
          "title",
          "parent_id",
          "path",
          "order"
        ],
        "properties": {
          "id": {"type": "integer", "minimum": 1},
          "slug": {"type": "string", "minLength": 1},
          "title": {"type": "string", "minLength": 1},
          "parent_id": {"type": ["integer", "null"], "minimum": 1},
          "path": {
            "type": "array",
            "items": {"type": "string", "minLength": 1}
          },
          "order": {"type": "integer", "minimum": 0}
        }
      }
    }
  }
}
